{
  "schema": "drp-solution/v1",
  "instance": "pontianak-south-20",
  "method": "alns",
  "routes": [
    {
      "drone": 0,
      "customers": [
        13,
        16,
        20,
        17
      ],
      "energy": 4.1798749820141925,
      "payload": 6.189241056267342,
      "legs": [
        {
          "from": 0,
          "to": 13,
          "distance": 0.2952128047244294,
          "onboard": 6.189241056267342,
          "energy": 0.843355768125311
        },
        {
          "from": 13,
          "to": 16,
          "distance": 0.20039064964705008,
          "onboard": 5.306936674786155,
          "energy": 0.5194287960158961
        },
        {
          "from": 16,
          "to": 20,
          "distance": 0.5080923675854572,
          "onboard": 3.9766906466744167,
          "energy": 1.1142502173325812
        },
        {
          "from": 20,
          "to": 17,
          "distance": 0.5085181465857879,
          "onboard": 1.9932504251515895,
          "energy": 0.8125993501496138
        },
        {
          "from": 17,
          "to": 0,
          "distance": 0.8902408503907902,
          "onboard": 4.440892098500626e-16,
          "energy": 0.8902408503907904
        }
      ]
    },
    {
      "drone": 1,
      "customers": [
        18,
        19
      ],
      "energy": 1.6011019215819524,
      "payload": 3.1222617229823735,
      "legs": [
        {
          "from": 0,
          "to": 18,
          "distance": 0.27687349183033144,
          "onboard": 3.1222617229823735,
          "energy": 0.5362149435254264
        },
        {
          "from": 18,
          "to": 19,
          "distance": 0.3253010666757644,
          "onboard": 1.4332688441617438,
          "energy": 0.465174231827451
        },
        {
          "from": 19,
          "to": 0,
          "distance": 0.5997127462290751,
          "onboard": -2.220446049250313e-16,
          "energy": 0.599712746229075
        }
      ]
    },
    {
      "drone": 2,
      "customers": [
        15,
        14,
        12,
        10
      ],
      "energy": 2.9362467123342286,
      "payload": 4.543977694677641,
      "legs": [
        {
          "from": 0,
          "to": 15,
          "distance": 0.2827689511100717,
          "onboard": 4.543977694677641,
          "energy": 0.6682376930875391
        },
        {
          "from": 15,
          "to": 14,
          "distance": 0.07379464491264238,
          "onboard": 3.287155306240711,
          "energy": 0.14656698249166483
        },
        {
          "from": 14,
          "to": 12,
          "distance": 0.5731502415194301,
          "onboard": 2.119540847416741,
          "energy": 0.9375948461015908
        },
        {
          "from": 12,
          "to": 10,
          "distance": 0.32776915808745305,
          "onboard": 1.2019024292655809,
          "energy": 0.44595312229054623
        },
        {
          "from": 10,
          "to": 0,
          "distance": 0.7378940683628876,
          "onboard": -2.220446049250313e-16,
          "energy": 0.7378940683628875
        }
      ]
    },
    {
      "drone": 3,
      "customers": [
        8,
        3,
        2,
        1
      ],
      "energy": 12.255941730080487,
      "payload": 6.678835064303303,
      "legs": [
        {
          "from": 0,
          "to": 8,
          "distance": 0.76027760293385,
          "onboard": 6.678835064303303,
          "energy": 2.2836082168575684
        },
        {
          "from": 8,
          "to": 3,
          "distance": 1.346445422857927,
          "onboard": 4.946992436729154,
          "energy": 3.344702019861953
        },
        {
          "from": 3,
          "to": 2,
          "distance": 0.777784509893792,
          "onboard": 3.2834639013613636,
          "energy": 1.543932718276084
        },
        {
          "from": 2,
          "to": 1,
          "distance": 0.9343169600129775,
          "onboard": 1.4376431999070003,
          "energy": 1.3372812872491089
        },
        {
          "from": 1,
          "to": 0,
          "distance": 3.7464174878357723,
          "onboard": -2.220446049250313e-16,
          "energy": 3.746417487835772
        }
      ]
    },
    {
      "drone": 4,
      "customers": [
        11,
        9,
        6,
        4,
        5,
        7
      ],
      "energy": 9.254729439148598,
      "payload": 6.756441120652521,
      "legs": [
        {
          "from": 0,
          "to": 11,
          "distance": 1.3426830945823105,
          "onboard": 6.756441120652521,
          "energy": 4.06421087625458
        },
        {
          "from": 11,
          "to": 9,
          "distance": 0.18709004588264444,
          "onboard": 5.80189248042355,
          "energy": 0.512732944993228
        },
        {
          "from": 9,
          "to": 6,
          "distance": 0.5220571765824246,
          "onboard": 4.1062883372954815,
          "energy": 1.16517236526297
        },
        {
          "from": 6,
          "to": 4,
          "distance": 0.7428114273682714,
          "onboard": 2.2959581692010884,
          "energy": 1.2544506168209024
        },
        {
          "from": 4,
          "to": 5,
          "distance": 0.6331977201771752,
          "onboard": 1.4581473842152006,
          "energy": 0.9101863999873882
        },
        {
          "from": 5,
          "to": 7,
          "distance": 0.15395303574118008,
          "onboard": 0.5078979568483625,
          "energy": 0.17741076543224454
        },
        {
          "from": 7,
          "to": 0,
          "distance": 1.1705654703972832,
          "onboard": 3.3306690738754696e-16,
          "energy": 1.1705654703972832
        }
      ]
    }
  ],
  "certificate": {
    "feasible": true,
    "reason": "feasible",
    "total_energy": 30.227894785159457,
    "drones_used": 5,
    "fleet_size": 5,
    "routes": [
      {
        "drone": 0,
        "customers": [
          13,
          16,
          20,
          17
        ],
        "energy": 4.1798749820141925,
        "weight": 6.189241056267342,
        "battery_ok": true,
        "payload_ok": true
      },
      {
        "drone": 1,
        "customers": [
          18,
          19
        ],
        "energy": 1.6011019215819524,
        "weight": 3.1222617229823735,
        "battery_ok": true,
        "payload_ok": true
      },
      {
        "drone": 2,
        "customers": [
          15,
          14,
          12,
          10
        ],
        "energy": 2.9362467123342286,
        "weight": 4.543977694677641,
        "battery_ok": true,
        "payload_ok": true
      },
      {
        "drone": 3,
        "customers": [
          8,
          3,
          2,
          1
        ],
        "energy": 12.255941730080487,
        "weight": 6.678835064303303,
        "battery_ok": true,
        "payload_ok": true
      },
      {
        "drone": 4,
        "customers": [
          11,
          9,
          6,
          4,
          5,
          7
        ],
        "energy": 9.254729439148598,
        "weight": 6.756441120652521,
        "battery_ok": true,
        "payload_ok": true
      }
    ]
  },
  "meta": {
    "seed": 1,
    "time_limit": 10.0,
    "wall_time": 10.000277042388916,
    "dual_bound": null,
    "optimal": false
  }
}